{
  "title": "VigoTech Alliance members JSON schema",
  "type": "object",
  "description": "",
  "$schema": "http://json-schema.org/draft-04/schema#",
  "additionalProperties": false,
  "required": [
    "name",
    "logo"
  ],
  "properties": {
    "name": {
      "type": "string",
      "description": "Alliance name"
    },
    "logo": {
      "type": "string",
      "description": "Logo url"
    },
    "sticker": {
      "type": "string",
      "description": "Sticker image url"
    },
    "links": {
      "type": "array",
      "description": "Alliance site and social links",
      "items": {
        "type": "object",
        "description": "Link",
        "required": [
          "key",
          "url"
        ],
        "properties": {
          "key": {
            "type": "string",
            "description": "Link key (used to show icon)"
          },
          "url": {
            "type": "string",
            "description": "Link url"
          }
        }
      }
    },
    "members": {
      "type": "array",
      "description": "Alliance members",
      "items": {
        "type": "object",
        "description": "Member",
        "required": [
          "key",
          "name",
          "logo"
        ],
        "properties": {
          "key": {
            "type": "string",
            "description": "Member unique id"
          },
          "name": {
            "type": "string",
            "description": "Alliance name"
          },
          "logo": {
            "type": "string",
            "description": "Logo url"
          },
          "sticker": {
            "type": "string",
            "description": "Sticker image url"
          },
          "links": {
            "type": "array",
            "description": "Alliance site and social links",
            "items": {
              "type": "object",
              "description": "Link",
              "required": [
                "key",
                "url"
              ],
              "properties": {
                "key": {
                  "type": "string",
                  "description": "Link key (used to show icon)"
                },
                "url": {
                  "type": "string",
                  "description": "Link url"
                }
              }
            }
          }
        }
      }
    }
  }
}